{
  "schema": "segment_manifest.v1",
  "vertical": "devdocs",
  "segment_id": "seg-20260726t150405z-0002",
  "created_at": "2026-07-26T15:09:41Z",
  "crawler_version": "0.1.0",
  "record_count": 34,
  "pages_file": "pages.jsonl.zst",
  "pages_sha256": "9f86d081884c7d659a2feaa0c55ad015a3bf4f1b2b0b822cd15d6c15b0f00a08",
  "bytes_compressed": 41237,
  "bytes_uncompressed": 190448,
  "first_fetched_at": "2026-07-26T15:04:07Z",
  "last_fetched_at": "2026-07-26T15:09:38Z"
}
